<?xml version="1.0" encoding="UTF-8" ?>
<!DOCTYPE RegAdmin [
	<!ELEMENT RegAdmin (Sensores,Calendario)>
	<!ELEMENT Sensores (Temperatura)*>
	<!ELEMENT Temperatura (id, alias)>
	<!ELEMENT id (#PCDATA)>
	<!ELEMENT alias (#PCDATA)>
	<!ELEMENT Calendario (usuario)>
	<!ATTLIST Calendario tipo CDATA #REQUIRED>
	<!ELEMENT usuario (#PCDATA)>
]>
<RegAdmin>
	<Sensores>
		<Temperatura>
			<id>28f5e9zf020000d2</id>
			<alias>Sensor superior</alias>
		</Temperatura>
		<Temperatura>
			<id>282ddbaf020000b0</id>
			<alias>Sensor inferior</alias>
		</Temperatura>
	</Sensores>
	<Calendario tipo="gmail">
		<usuario>sysreg1</usuario>
	</Calendario>
</RegAdmin>